{
  "pact": "0.3",
  "type": "Challenge",
  "vtc_id": "vtc_9f2c11",
  "delivery_hash": "sha256:dfabe6a5d1aaf23868dec65e1517dc0dfa911b41054ea10d641bb919aed34c95",
  "proof": {
    "profile": "acceptance",
    "instrument_hash": "sha256:0bdde1ab6b081d2b4bda580c5393756ae95c10b8351c9c55eb9316416265fc1b",
    "results_hash": "sha256:7f05a60223e24ca9393e0c241d0448cb5f39e5edb71c117fb7d3d593d5861b40",
    "results_uri": "https://watch.example/o/a91e",
    "failing_checks": [
      "schema_valid_rate",
      "row_count_min"
    ]
  },
  "costs": {
    "amount": "1.20",
    "currency": "USDC"
  },
  "signature": {
    "protected": "eyJhbGciOiJFZDI1NTE5Iiwia2lkIjoiZGlkOndlYjp3YXRjaC5leGFtcGxlI2sxIiwidHlwIjoiYXBwbGljYXRpb24vdm5kLnBhY3QuY2hhbGxlbmdlK2pzb24ifQ",
    "signature": "uVHzXamolK8O5wU2lJeWXh0sD8qNgcePTgBT83-Z6QWitVs_TKhRHpE3QcDu3mb-30QeheTIDGOjU0EbmqaMBQ"
  }
}
